Y,40,Whitefish,Taryn A.,Virginia,8/17/14,1,"After hiking the Danny On Trail and starving, the Base Lodge Cafe was very disappointing. The buffalo burger, bacon, onions, and bun were all burnt (black) and not enjoyable. The onion rings were good and my boyfriend said the milkshake was good. But for a burger that's $13 (not including shake and onion rings) I would expect much better."
Y,41,Whitefish,John W.,Montana,8/5/12,4,"We did the zip line and new aerial course this past weekend.  All I can say is it is great family time.  I felt safe and the staff is very courteous.  Bring a pocket full of money as it is expensive to do all you will want to.  The new aerial course is fun and both my 20 year old as well as 10 year old were challenged.  

Very much recommend."
Y,42,Whitefish,Maximillian S.,California,12/17/14,5,"Great place to ski, snowboard, and relax. They have a bunch of runs and slopes open. The staff is super nice and helpful! The lodges have really good food and a lot of beer and drinks to choose from. The hot apple cider is really good and soothing. Awesome place to go!"
Y,43,Whitefish,Kristy W.,Washington,12/29/16,5,"Highly recommend for beginners!  Nice price of $22 (kids 6 and under free) for three of the green beginner chairlifts plus magic carpet. The magic carpet is a zoo, but chair nine is perfect for a kid (or adult) with only a day or two of skiing experience. Such a great run!  Gradual and scenic.  We saw deer from the chairlift.  There is even a nice view of the valley! Also loved the lodge and its reasonably priced fare."
Y,44,Whitefish,Vicki L.,California,6/9/12,5,"Great pool, hot tub, spa, location on the lake. Very friendly service. Loving this place!"
Y,45,Whitefish,Becky J.,Minnesota,3/24/17,5,"Great skiing, incredible scenery, reasonable prices!"
Y,46,Whitefish,Jennifer S.,Arizona,9/8/13,5,"We checked out the Walk in the Treetops Friday morning and had a great experience!  Our guides were friendly, knowledgeable and made us feel comfortable on our journey.  The walk itself was really cool and afforded beautiful views of the Flathead Valley.  This is a must do when visiting the area!"
Y,47,Whitefish,Truth S.,Montana,3/2/11,4,"A great hill to spend the day at with the fam.

Pros-

Gets a ton of great snow
Nice snow park for boarders
Good front and backside
Close to town
Many Runs and limitless terrain to explore
Several nice bars to relax and enjoy some beverages
Staff is friendly and helpful
Lots of friendly Montanans and Canadians
---- Go to Costco and get 2 lift tickets for $100 ($64 at the hill)

Cons-

Not a ""Resort"" experience like advertised, at least not like other high end hills  
FOG city, any given day can become a socked in toilet bowl of clouds. I have struggled finding the bottom of the hill at the end of the day it has been so cloudy.
It's rare to get good visibility.
The rack rate of $64 is too much for this hill. However the location drives the price. Regular skiers will always get the season pass which is a good deal.

All in all, it's a great hill and you will enjoy yourself. Just check the weather 1st!"
Y,48,Whitefish,Corey L.,Massachusetts,3/3/14,5,"My girlfriend's father lives in Kalispell, so they come every winter for a week of skiing. They love it. It's out of the way so not often packed, but the mountain and skiing are top of the line. This is my first trip in the first week of March. It's been the coldest it's ever been in March, lifts closed, NOT comfortable. As it warmed slightly, it started snowing a lot. It's been pretty bad weather, but the slopes are still really fun and great. My girlfriend's family are all hardcore skiers and she told me it was a solid Yelp 5. I don't know skiing that well, but she said it's comparable to any world class slope, just a bit removed. And unlike Colorado, not nearly as sunny. Also the snow is pretty light it seems - good powder, not much ice or heavy snow"
Y,49,Whitefish,Mitch L.,Washington,3/17/12,3,"Whitefish is a pretty decent mountain for beginner to advanced skiers.  It's very family-friendly, with a good variety of runs easily accessible from the main lift.  It's also a fairly big mountain, with four skiable peaks and more than eight lifts and t-bars.

During my visit, the weather was fairly warm and wet, but there was still some pretty great powder near the summit.  Some friendly locals showed me some great runs.  One required what I'd describe as a ""medium length"" hike, but the payoff was a spectacular stash of virgin powder on some great terrain.  Thanks, guys!

The resort itself is beautiful.  I was very impressed with the size, quality, and cleanliness of the room I stayed in.  That said, the bed was hard enough that it did give me some trouble sleeping, and for how many buildings there are in the ""village,"" there's surprisingly little selection in terms of food.

My review has been very positive so far, so you might wonder why I've only given Whitefish 3/5 stars.  Well, there are a few downsides.  First, although the mountain has a lot of skiable area, the vertical drop is only 2353 feet (717 meters.)  Compared to nearby mountains like Revelstoke, that's not great, and it's very evident in the runs.

While there is lots of good terrain to be found, the best spots are difficult to get to, and because there's so little vertical, the challenging terrain will only last you a couple minutes if you know what you're doing.  After that, you're stuck on long, slow, boring cat tracks to get back to the lift.  I really enjoyed Hellroaring Basin and the East Rim Face, but the former comes out at the bottom of a rickety old chair that takes forever to get back up the mountain, and the latter can be bombed down in a matter of seconds when the snow is good, only to leave you with a ten-minute slog across a mostly-flat green run.

My other complaint is that the resort staff don't seem to be super diligent about opening lifts on time and keeping guests informed about closures.  On the first day of my visit, the opening of the main chair was delayed by half an hour because rime from the previous night had to be cleaned off the seats.  I find that a little perplexing given that the chair normally opens at 9:30, which is already a half-hour later than every other resort I've ever been to.  Additionally, they didn't do a great job of communicating about the situation to the people waiting in line.  To be fair, ice-covered chairs are a safety issue and sometimes the weather causes unexpected surprises, so I'd readily forgive the staff for being a half hour late to open the chair one day.  

What I won't  forgive, though, is that on the second day the Bigfoot T-Bar was closed for no apparent reason, with no indication of its closure on any of the signs I looked at.  I know what you're thinking: why would you want to ride a t-bar anyway?  From what I understand (and from what I've seen of the area), the Bigfoot services some pretty respectable powder runs.  I was annoyed that I rode down to it twice only to find it closed.

To finish this ""compliment sandwich"" and summarize, I did enjoy my time at Whitefish, and it is a good resort.  Families will love it here, and if you're coming from southern Montana there's probably nothing better around.  However, if you're an expert skier or snowboarder--you eat black diamonds for breakfast and only start to work up a sweat when you're on a gnarly double-black--then you may find yourself growing bored of the mountain before too long.  If you're coming in from the Calgary area, there are a several better mountains within the same distance (for example, Kicking Horse and Revelstoke).  

Everyone should give Whitefish a try, but you might not want to book a week-long ski trip here if you're looking for seriously challenging terrain."
Y,50,Whitefish,Anne F.,Illinois,7/21/13,3,My family of 5 just stayed at the Sherpa in Whitefish for a few days with a goal of visiting Glacier.  The accomodations were very nice and there was plenty of room for us all. I don't know that it was worth the price but it was very nice.  (We loved being close to the pool.)  We loved going down the alpine slide and the Zipline the staff was very helpful. Everything on this mountain was pricey (especially for a slow summer day- and I bring tip cash with you).  Abbey and Jenny were awesome zipline guides!
Y,51,Whitefish,Lorand M.,Indiana,12/26/11,5," love this place.....HUGE...lots of great runs....relatively inexpensive overall...great locals....unbelievably nice people on the Mountain !

THE only negative...it can be foggy !  

This aint Aspen...there are no massage therapists doing lift line massages...of course..there really are no lift lines !

The town...and other close by towns are very nice with reasonably priced booze...food...entertainment.

This and the variety of resorts around SLT are THEEE best places to ski in the USA !"
Y,52,Whitefish,Ashley S.,California,12/30/14,5,"I highly recommend the Ski Classes and the ski instructor Lori (from Ohio.) I haven't skied since I was a little kid- a super beginner. She was super experienced, super patient, super informative, super cheer leader even when I felt like I wasn't performing well. I took 3 classes with her back to back. Without her wisdom, guidance, advice, and most importantly, her enthusiasm, I would have quit after the first 20 minutes. I cannot recommend her enough!"
Y,53,Whitefish,Michelle H.,Montana,7/9/12,5,I did the zip line and what a blast!! Our guides were wonderful and made sure our group was safe. This is something that everyone should try once!!
Y,54,Whitefish,Amanda J.,North Dakota,1/28/14,5,"Great skiing, even better views! Our kids have been begging to ride the train and we finally gave in and traveled to Whitefish from ND on the Amtrak. The ride there was full of excitement and playing cards. It was simple to get to the Resort from the train station via a taxi.  The reservation staff found the perfect property to stay within our budget and had lift tickets waiting for us at the front desk. The property was so close to the slopes we could have skied in the backdoor. Beware with being so close also means the groomers are that close, but when you are tired from skiing such a skiing such long runs, for us flat-landers it is a big hill, it doesn't really matter. We had some fog and some sun. We wish they would keep the restaurants in the Village open longer as it was difficult to get a good supper. The ride home on the train was not as fun as the ride there. We will definitely drive next time."
Y,55,Whitefish,Rick C.,Washington,5/15/11,4,"Whitefish, Montana: We ski / snowboarded right from our condo down a ""trail"" for about (3/4) of a mile to the main lifts.  Purchased our lift tickets and went up the mountain.  When it was lunch time, we ski / snowboarded down one of the runs behind our Condo, walked about 100 feet and entered the unit ...... that was really convenient!  Day One: beautiful day, could see Glacier National Park from the summit.  Day Two: foggy ... very foggy ... not fun!  The mountain is really spread out, tons of runs, very fast lifts, many QUADS... we will be back"
Y,56,Whitefish,Kim R.,California,5/1/12,4,"Pretty good hill. As another reviewer said though, it can get VERY foggy here, and it definitely dampens the skiing experience. However, sometimes on the summit you can rise above the bank of fog, and then the view is breathtaking. Definitely recommend going all the way to the top first, don't mess around with the other lifts unless you have inexperienced skiiers with you. The lodges are awesome, good food and fireplaces! Definitely a plus when my feet are frozen! They have ski lessons, and smaller slopes for kids as well. Pretty good place to ski!"
Y,57,Whitefish,Johnny C.,Montana,2/15/13,1,"Very, very unhappy right now.  As a local, living in Kalispell, I've been taking my skibike to this resort for 10 years, and last sunday, after getting on the lift and taking a run, I was pulled aside just as I was getting ready to get on the lift, a 2nd time,  told they'd had a change in policy, and I was no longer allowed to use a skibike unless I also had short skis on my feet.  I wear Sorel type boots when I ride and always have so of course I can't hook into bindings and what's the point of the bike if you have skis on your feet too, you might as well just ski.  So, they refunded my money and sent me home.  1 big problem is, after all these years of allowing me full use of all lifts, say I'd invited a skibiker from outta state, they came with me, took a run, and were told ""uh, change in policy"".  Uh, wouldn't the outta stater be discouraged after, being told honestly ""Whitefish Mtn Resort has allowed me on the lift for 10 years"", spending money to come here and ...you get the idea.  Yes skibikes have not achieved the mainstream acceptance snowboards have, but remember back in the late 80""s when very few resorts allowed snowboards on the lift?  Over the years I have encountered liftees who were not familiar with skibikes, or me, and was sent home one evening after skiing for more than 2 hours.  I made a stink about it and the next day administration assigned 2 patrol to watch me get on and off the lift and ski 3 runs with me to see if I was a hazard.  Their conclusion was, no, my feet and boots never touch the ground when getting off the lift and I could ski with general traffic, keep up, and not create a hazard.  They apologized for the nite before, told me I was good to go and that was 7 years ago, no concerns or funny looks since then.  So imagine my disdain when, this season, after having already been up there with the skibike on New Years Eve, having the disappointment, and embarrassment, of being pulled aside just as I was about to get on the lift, being taken into the shack there, put on the phone with management and told I was done for the day.  Funny thing is, for YEARS, before the resort changed hands 5/6 years ago, they used to RENT skibikes.  Yes they were awful, clunky things and you were supposed to have skis on your feet also, but...My how things change.  So.  Being that Blacktail Mountain locally has allowed me to spend my money there with no hassle for 10 years, I believe I will have to grace their slopes with my unique sport.  bummer.  I have included a pic here of me taken at Whitefish Mtn Resort on my skibike.  This resort needs to appreciate the locals more.  WE ARE THE ONES WHO ACTUALLY PAY YOUR WAY.  facebook.com/photo.php?f…"
Y,58,Whitefish,Phil N.,Washington,2/15/09,4,"Whitefish is a hidden gem and usually boasts some of the fluffiest, dry snow with over 120 inch base.  But this year, although there is a little over 80 total inches, it still is good boarding.  

The town itself is quaint and has good bars and restaurants.  Great winter getaway trip."